company_name,contact,address,city,state,zip,country,phone,email,fax,notes,operations,commodities,urlFlorance Distributing Co Inc,,4555 Pacific Blvd,VERNON,CA,90058-2207,USA,(323) 585-1172,flordist@florance.com,(323) 585-3328,,"Broker, Shipper, Produce,","Cantaloupes, Carrots, Cauliflower, Celery, Fruits, Grapes, Lettuce, Mixed Vegetables, Onions, Strawberries, Tomatoes,",Http://www.florance.comFoodSource Nogales a C H Robinson Company,,"2420 N Frank Reed Rd, # D",NOGALES,AZ,85621,USA,(520) 761-1348,,(520) 761-2858,,"Broker, Distributor, Exporter, Grower, Importer, Sales Agency, Shipper, Produce,","Apples, Apricots, Avocados, Beets, Bibb Lettuce, Blackberries, Blueberries, Broccoli, Brussels Sprouts, Cabbage, Cantaloupes, Cantaloupes, Carrots, Cauliflower, Celery, Cherries, Citrus Fruits, Endive, Figs, Garlic, Grapes, Green Beans, Green Peas, Greens, Honeydew Melons, Kiwi, Leeks, Lemons, Lettuce, Limes, Mangoes, Melons, Nectarines, Organic, Papayas, Peaches, Pears, Peppers, Pineapples, Plums, Potatoes, Pumpkins, Radishes, Raspberries, Romaine, Rutabaga, Salads, Spinach, Squash, Strawberries, Sweet Potatoes, Tomatoes, Turnips, Watermelons,","FoodSource, a C H Robinson Company",,"100 Wilson Rd, Ste 200",MONTEREY,CA,93940-7885,USA,(831) 647-3090,administrator@buyfoodsource.com,(831) 647-3095,,"Broker, Distributor, Exporter, Grower, Importer, Sales Agency, Shipper, Produce,","Apples, Apricots, Artichokes, Asparagus, Avocados, Beets, Bibb Lettuce, Blackberries, Blueberries, Broccoli, Brussels Sprouts, Cabbage, Cantaloupes, Cantaloupes, Carrots, Cauliflower, Celery, Cherries, Citrus Fruits, Endive, Figs, Garlic, Grapes, Green Beans, Green Peas, Greens, Honeydew Melons, Kiwi, Leeks, Lemons, Lettuce, Limes, Mangoes, Melons, Nectarines, Organic, Papayas, Peaches, Pears, Peppers, Pineapples, Plums, Potatoes, Pumpkins, Radishes, Raspberries, Romaine, Rutabaga, Salads, Spinach, Squash, Strawberries, Sweet Potatoes, Tomatoes, Turnips, Watermelons,",Http://www.buyfoodsource.comForrence Orchards Inc,,2731 STATE ROUTE 22,PERU,NY,12972-4732,USA,(518) 643-9527,,(518) 643-9509,,"Exporter, Grower, Shipper, Produce,","Apples,",Fresh 1 Marketing Inc,,,NOGALES,AZ,0,USA,(480) 607-1220,bob.biesterfeld@chrobinson.com,,,"Broker, Customs Broker, Distributor, Executive Headquarters, Exporter, Freight Contractor, Importer, Intermodal Transp, Repacker, Shipper, Produce, Transportation,","Fruits, Vegetables,",Fresh 1 Marketing Inc,,,MINNEAPOLIS,MN,55344,USA,,,,,"Broker, Customs Broker, Distributor, Executive Headquarters, Exporter, Freight Contractor, Importer, Intermodal Transp, Repacker, Shipper, Produce, Transportation,","Fruits, Vegetables,",Fresh Kist Produce LLC,,PO BOX 3617,SALINAS,CA,93912-3617,USA,(877) 886-7650,,(831) 455-8033,,"Grower, Packer, Shipper, Produce,","Broccoli, Brussels Sprouts, Cabbage, Cauliflower, Celery, Escarole, Leeks, Lettuce, Mixed Vegetables, PMA Member, Radishes, Roma, Romaine, Spinach, Spring Mix, Strawberries,",Http://www.freshkist.comFresh Kist Produce LLC,,PO Box 119,GUADALUPE,CA,93434-0119,USA,(877) 387-5006,,(805) 343-3309,,"Grower, Packer, Shipper, Produce,","Broccoli, Brussels Sprouts, Cabbage, Cauliflower, Celery, Lettuce, Mixed Vegetables, Radishes, Roma, Romaine, Spinach, Spring Mix, Strawberries,",Http://www.freshkist.comFresh Start Produce Sales Inc,,,MORVEN,GA,31638,USA,(229) 263-7501,,(229) 263-8652,,"Sales Agency, Shipper, Produce,","Cabbage, Cucumbers, Green Beans, Peppers, Squash,",Fresh Start Produce Sales Inc,,2260 Jones Ferry Rd,ELBERTON,GA,30635-4637,USA,(706) 283-0096,,(706) 283-0192,,"Broker, Fresh Cut Processor, Sales Agency, Shipper, Produce,","Cucumbers, Mixed Vegetables, Southern Veg,",Freska Produce International LLC,,511 Mountain View Ave,OXNARD,CA,93030,USA,(805) 650-1040,chuy@freskaproduce.com,(805) 650-3550,,"Exporter, Importer, Shipper, Produce,","Limes, Mangoes,",Http://www.freskaproduce.comFreyco Produce Inc,,10146 S State Rd 241,DECKER,IN,47524-7110,USA,(812) 769-2400,,(812) 769-5100,,"Broker, Grower, Packer, Repacker, Shipper, Produce,","Cantaloupes, Fresh Cut, Fruits, Grapefruit, Onions, Oranges, Organic, Potatoes, Tomatoes, Vegetables, Watermelons,",Fruit Royale Inc,,PO Box 970,DELANO,CA,93216-0970,USA,(661) 720-2740,lgalvan@fruitroyale.com,(661) 720-2745,,"Buying Broker, Broker, Shipper, Produce,","Cherries, Citrus Fruits, Fruits, Grapes, Melons, Stone Fruit, Vegetables,",Fruit Royale Inc,,10165 Buffton Dr,ST LOUIS,MO,63123-5205,USA,(314) 638-7949,pwoodling@fruitroyals.com,(314) 638-3505,,"Buying Broker, Exporter, Importer, Shipper, Produce,","Avocados, Cherries, Citrus Fruits, Grapes, Melons, Mixed Vegetables, Potatoes, Stone Fruit, Strawberries, Vegetables,",Http://www.fruitroyale.com"Funderburk Co Inc, G A",,PO BOX 338,JEFFERSON,SC,29718-0338,USA,(843) 658-3405,,(843) 658-3313,,"Broker, Packer, Shipper, Produce,","Watermelons,",Garber Farms,,3405 DESCANNES HWY,IOTA,LA,70543-3118,USA,(337) 824-6328,layamla@aol.com,(337) 824-2676,,"Grower, Packer, Shipper, Produce,","PMA Member, Sweet Potatoes,","Gardikas Produce Co Inc, Dimetri",,14811 MARQUARDT AVE,SANTA FE SPRINGS,CA,90670-5126,USA,(562) 404-4779,,(562) 407-3888,,"Distributor, Food Service, Grower, Jobber, Repacker, Shipper, Produce,","Cantaloupes, Christmas Trees, Citrus Fruits, Dried Beans, Honeydew Melons, Melons, Oranges, PMA Member, Pumpkins, Squash, Watermelons,","Gilliland Melons L L C, Ray",,206 DEERWOOD DR,PRATTVILLE,AL,36067-3831,USA,(334) 365-6977,,(334) 361-7560,,"Grower, Shipper, Produce,","Pumpkins, Watermelons,","Gilliland Melons L L C, Ray",,382 FINLEY AVE W,BIRMINGHAM,AL,35204-1050,USA,(205) 251-7464,,(334) 361-7560,,"Grower, Shipper, Produce,","Fruits, Vegetables, Watermelons,",Global Fruit Marketing Inc,,41 ORCHARD ST,RAMSEY,NJ,07446-1158,USA,(201) 818-1533,roberto@globalfruitmarketing.com,(201) 818-4566,,"Broker, Importer, Shipper, Produce,","Asparagus, Fruits, Garlic, Grapes, Melons, Nectarines, Pears, Plums, Vegetables,",Gloucester County Packing Co (Inc),,PO BOX 178,WOODBURY,NJ,08096-7178,USA,(856) 845-0195,,(856) 384-1798,,"Repacker, Shipper, Produce,","Onions, Potatoes,","Goddard Co Inc, Steven",,1400 E OLYMPIC BLVD STE 206,LOS ANGELES,CA,90021-1945,USA,(213) 624-9582,,,,"Distributor, Shipper, Produce,","Apples, Cantaloupes, Fruits, Grapes, Honeydew Melons, Nectarines, Peaches, Plums,",Gold Coast Packing Co Inc,,PO BOX 1023,SANTA MARIA,CA,93456-1023,USA,(805) 928-2593,sales@goldcoastpack.com,(805) 922-8719,,"Food Service, Grower, Processor, Shipper, Produce,","Broccoli, Cauliflower, Celery, Cilantro, Fresh Cut, Green Onions, Herbs, Lettuce, Mixed Vegetables, PMA Member, Spinach, Strawberries,",Http://www.goldcoastpack.comGold Ribbon Potato Co,,PO BOX 178,ARVIN,CA,93203-0178,USA,(661) 854-4421,,(661) 854-3805,,"Grower, Packer, Shipper, Produce,","Potatoes,",Golden West Produce LLC,,PO Box 456,PARMA,ID,83660-0456,USA,(541) 372-3122,goldenwestproduce@msn.com,(541) 372-3186,,"Grower, Packer, Shipper, Produce,","Onions,",Gourmet Trading Company,,PO BOX 88432,LOS ANGELES,CA,90009-8432,USA,(310) 216-7575,chrismartin@gourmettrading.net,(310) 216-7676,,"Distributor, Exporter, Importer, Shipper, Produce,","Apricots, Asparagus, Blackberries, Blueberries, Fruits, Limes, Mangoes, Melons, Papayas, Raspberries, Vegetables,",Http://www.gourmettrading.netGourmet Trading Company,,PO Box 3186,PASCO,WA,99302-3186,USA,(509) 543-1191,,(509) 543-9722,,"Distributor, Exporter, Importer, Shipper, Produce,","Apricots, Asparagus, Blackberries, Blueberries, Fruits, Limes, Mangoes, Melons, Papayas, Raspberries, Vegetables,",GPOD of Idaho,,PO BOX 514,SHELLEY,ID,83274-0514,USA,(208) 357-7691,gpod@gpod.org,(208) 357-5151,,"Shipper, Produce,","Potatoes,",Great West Produce Inc,,2600 S EASTERN AVE,LOS ANGELES,CA,90040-1402,USA,(323) 869-0200,,(323) 869-0202,,"Buying Broker, Shipper, Produce,","Apples, Apricots, Artichokes, Asparagus, Beets, Broccoli, Cabbage, Cantaloupes, Carrots, Cauliflower, Celery, Cherries, Chili, Escarole, Grapefruit, Grapes, Green Beans, Green Peas, Greens, Herbs, Honeydew Melons, Leeks, Lemons, Lettuce, Limes, Mandarin Orange, Melons, Mixed Vegetables, Napa, Nectarines, Oranges, Organic, Peaches, Pears, Plums, Pumpkins, Romaine, Rutabaga, Spinach, Sprouts, Squash, Strawberries, Sweet Corn, Tangelos,",Green Circles Farm,,1393 YATES SPRING RD,BRINSON,GA,39825-2017,USA,(229) 246-6165,pgcfarms@surfsouth.com,(229) 246-8135,,"Grower, Shipper, Produce,","Peppers, Squash, Sweet Corn,",Green Star Produce Marketing,,430 Tallyho Rd,SANTA MARIA,CA,93455,USA,(805) 937-9530,robert.greenstarproduce@verizon.net,(805) 926-4622,,"Distributor, Shipper, Produce,","Anise, Artichokes, Basil, Beets, Bok Choy, Cabbage, Celery, Celery Root, Celery Root, Chard, Chives, Cilantro, Collards, Daikon, Daikon, Dill, Endive, Greens, Herbs, Kale, Kohlrabi, Leeks, Mint, Mustard Greens, Napa, Parsley, Radicchio, Rappini, Romaine, Snowpeas, Specialty Fruit, Spinach, Turnips, Watercress,",GreenLine Foods Inc,,PO Box 1110,BOWLING GREEN,OH,43402-1110,USA,(419) 354-1149,glcustomerservice@greenlinebeans.com,(419) 352-2146,,"Fresh Cut Processor, Grower, Packer, Shipper, Produce,","Green Beans, PMA Member, Snowpeas,",Http://www.greenlinebeans.comGreenridge Fruit Inc,,5154 PEACH RIDGE AVE NW,GRAND RAPIDS,MI,49544-9759,USA,(616) 784-2770,sales@greenridgefruit.com,(616) 784-5162,,"Exporter, Packer, Shipper, Produce,","Apples, Asparagus, Blueberries, Fruits, Peaches, Plums, Pumpkins, Vegetables,",Http://www.greenridgefruit.comGriffin Holder Co Inc,,"525 E Lomhan, Ste A",LAS CRUCES,NM,88001-3394,USA,(800) 525-5397,,,,"Shipper, Produce,","Onions,",Griffin-Holder Co Inc,,PO BOX 511,ROCKY FORD,CO,81067-0511,USA,(719) 254-3363,,,,"Grower, Shipper, Produce,","Onions,",Griffin-Holder Co Inc,,23595 WELD CO RD 62,GREELEY,CO,80631,USA,(800) 525-5397,,,,"Shipper, Produce,","Onions,",Growers Exchange Co Inc,,PO BOX 368,FORT FAIRFIELD,ME,04742-0368,USA,(207) 473-7861,kirk@growers-exchange.com,(207) 473-7865,,"Buying Broker, Broker, Distributor, Shipper, Produce,","Fruits, Potatoes, Vegetables,",Gunnels Farms Inc,,47722 COUNTY ROAD C,CENTER,CO,81125-9305,USA,(719) 754-2471,gunnels@seedpotato.com,(719) 754-3882,,"Grower, Packer, Shipper, Produce,","Potatoes, Seed Potatoes,",Http://www.seedpotato.comGurda Gardens Ltd,,PO BOX 858,GOSHEN,NY,10924-0858,USA,(845) 374-5741,,(845) 374-7204,,"Broker, Distributor, Grower, Shipper, Produce,","Lettuce, Mixed Vegetables, Onions, PMA Member,","Gurda Produce Co, A",,PO BOX 2356,MIDDLETOWN,NY,10940-7831,USA,(845) 258-4422,agurda@optonline.net,(845) 258-4852,,"Grower, Repacker, Shipper, Produce,","Lettuce, Onions, Vegetables,",Hadley Inc,,83555 AIRPORT BLVD,THERMAL,CA,92274-9127,USA,(760) 399-5191,,(760) 399-1311,,"Grower, Packer, Shipper, Produce,","Dates,",Http://www.hadleys.com"Hall & Sons, J G",,PO BOX 8,EDINBURG,ND,58227-0008,USA,(701) 993-8334,ghall@polarcomm.com,(701) 894-6114,,"Grower, Shipper, Produce,","Potatoes,","Hall & Sons, J G",,RR 1 BOX 33,EDINBURG,ND,58227-,USA,(701) 894-6112,,(701) 894-6114,,"Shipper, Produce,","Potatoes,",Hall's Produce Inc,,PO Box 358,OAKTOWN,IN,47561-0358,USA,(812) 745-2008,,(812) 745-2007,,"Grower, Packer, Repacker, Shipper, Produce,","Cantaloupes, Melons, Pumpkins, Watermelons,","Hansen Produce Inc, Elmer",,PO Drawer A.i.,MOSES LAKE,WA,98837-0010,USA,(509) 765-3638,,(509) 765-6708,,"Sales Agency, Shipper, Produce,","Onions,",Hartmann Foods Inc,,"7829 Center Blvd SE, #301",SNOQUALMIE,WA,98065-9096,USA,(425) 396-3003,sales@hartmannfoods.com,(917) 464-8272,,"Shipper, Produce,","Apples, Apricots, Asparagus, Cherries, Clementine, Grapes, Kiwi, Lemons, Melons, Nectarines, Onions, Oranges, Peaches, Pears, Peppers, Plums, Pluot, Potatoes, Strawberries, Tangerines,",Http://www.hartmannfoods.com"Harvey & Son Inc, Glenn",,5011 NICHOLS RD,KALAMAZOO,MI,49004,USA,(269) 353-3255,rick@harveyandson.com,(269) 353-3589,,"Shipper, Produce,","Blueberries, Cabbage, Carrots, Celery, Cherries, Cucumbers, Eggplant, Flowers, Fresh Cut, Fruits, Grapes, Green Beans, Leeks, Lettuce, Onions, Peppers, Plants, Squash, Sweet Corn, Tomatoes, Vegetables,",Http://www.harveyandson.com"Harvey & Son Inc, Glenn",,5011 Nichols Rd,KALAMAZOO,MI,49004,USA,(269) 353-3255,rick@harveyandson.com,(269) 353-3589,,"Shipper, Produce,","Blueberries, Cabbage, Carrots, Celery, Cherries, Cucumbers, Flowers, Fruits, Green Beans, Lettuce, Lettuce, Onions, Peppers, Tomatoes, Vegetables,",Hearty Fresh Inc,,PO Box 404,BYRON CENTER,MI,49315,USA,(616) 878-4100,,(616) 878-4140,,"Cold Storage, Packer, Repacker, Shipper, Produce,","Apples, Cauliflower, Celery, Celery Hearts, Cucumbers, Fruits, Mixed Vegetables, Onions, Peppers, Potatoes,","Heimos Produce Co Inc, George A",,32 PRODUCE ROW # 42,SAINT LOUIS,MO,63102-1496,USA,(314) 231-3788,jheimos@heimosproduce.com,(314) 621-5156,,"Commission Merchant, Distributor, Jobber, Shipper, Produce,","Apples, Apricots, Artichokes, Asparagus, Avocados, Bananas, Beets, Blackberries, Blueberries, Broccoli, Brussels Sprouts, Cabbage, Cantaloupes, Carrots, Cauliflower, Celery, Cherries, Chili, Citrus Fruits, Coconuts, Cranberries, Dried Fruit, Eggplant, Garlic, Grapefruit, Green Beans, Green Onions, Green Peas, Greens, Herbs, Honeydew Melons, Kiwi, Leeks, Lemons, Lettuce, Limes, Mangoes, Melons, Mushrooms, Nectarines, Okra, Onions, Oranges, Papayas, Peaches, Pears, Peppers, Pineapples, Plums, Potatoes, Pumpkins, Radishes, Raspberries, Romaine, Rutabaga, Salads, Spinach, Sprouts, Squash, Sweet Corn, Sweet Potatoes, Tomatoes, Turnips, Watermelons,",Henggeler Packing Co Inc,,PO BOX 313,FRUITLAND,ID,83619-0313,USA,(208) 452-4211,henggelerpkg@fmtc.com,(208) 452-5416,,"Grower, Shipper, Produce,","Apples, Peaches, Plums, Prunes,",Hickenbottom & Sons Inc,,301 WAREHOUSE AVE,SUNNYSIDE,WA,98944-1309,USA,(509) 837-4100,,(509) 837-5130,,"Packer, Shipper, Produce,","Asparagus, Fruits, Peppers, Rutabaga, Squash, Vegetables,","Hill Farms Inc, Tull",,2264 HUGO RD,KINSTON,NC,28501-7173,USA,(252) 523-4406,thf98@esn.net,(252) 523-8052,,"Grower, Packer, Shipper, Produce,","Peppers, Potatoes, Sweet Potatoes,",Hines Farms,,53795 BANNER RD,DELTA,CO,81416-9410,USA,(970) 874-4173,,(970) 874-5401,,"Grower, Packer, Shipper, Produce,","Onions,",Hollar & Greene Produce Co Inc,,PO BOX 3500,BOONE,NC,28607-0800,USA,(828) 264-2177,info@hollarandgreene.com,(828) 264-4413,,"Shipper, Produce,","Cabbage, PMA Member, Potatoes,",Http://www.hollarandgreene.comHollar & Greene Produce Co Inc,,,MOULTRIE,GA,28607,USA,(828) 264-2177,info@hollarandgreene.com,,,"Shipper, Produce,","Cabbage,",Http://www.hollarandgreene.com"Horton Fruit Co Inc, The",,4701 JENNINGS LN,LOUISVILLE,KY,40218-2967,USA,(502) 969-1371,bbenoit@hortonfruit.com,(502) 964-1515,,"Fresh Cut Processor, Food Service, Jobber, Repacker, Shipper, Produce,","Apples, Bananas, Fresh Cut, Fruit Baskets, Hothouse Veg, Kale, Onions, Packaging Material, Saladmix, Spinach, Tomatoes,",Http://www.hortonfruit.comHronis Inc,,10443 Hronis Rd,DELANO,CA,93215-9556,USA,(661) 725-2000,salesdept@hronis.net,(661) 725-5403,,"Grower, Packer, Shipper, Produce,","Grapes, Oranges,",Http://www.hronis.netHuntsinger Farms Inc,,211 E Mountain Rd,HEGINS,PA,17938-9002,USA,(570) 682-3342,huntsing@epix.net,(570) 682-3419,,"Distributor, Grower, Packer, Repacker, Shipper, Produce,","Potatoes,",Huron Produce Ltd,,"4051 Camelot Cr, Unit B",LONGMONT,CO,80504,USA,(970) 377-2720,mmiles@huronproduce.com,(970) 535-4024,,"Buying Broker, Distributor, Importer, Repacker, Shipper, Produce,","Cucumbers, Fruits, Greenhouse, Hothouse Cucumbers, Hothouse Peppers, Hothouse Tomato, Hothouse Veg, Hydroponic, Peppers, Tomatoes, Vegetables,",Interfresh Inc,,2019 W Orangewood Ave,ORANGE,CA,92868,USA,(714) 449-1669,,(714) 385-9099,,"Broker, Distributor, Exporter, Sales Agency, Shipper, Produce,","Apples, Avocados, Cantaloupes, Citrus Fruits, Grapes, Honeydew Melons, Kiwi, Persimmons, Pineapples, PMA Member, Shallots,",Http://www.getinterfresh.comJ & J Ranch Produce Inc,,PO BOX 1861,INDIO,CA,92202-1861,USA,(760) 772-7383,jeffr@jjranchpro.com,(760) 772-7388,,"Distributor, Shipper, Produce,","Apples, Avocados, Cucumbers, Eggplant, Fruits, Grapes, Green Beans, Green Onions, Mixed Vegetables, Peppers, PMA Member, Radishes, Squash, Strawberries, Vegetables,",Http://www.jjranchpro.comJ Michael & Co,,1019 SUMMER HOLLY LN,ENCINITAS,CA,92024-6840,USA,(760) 634-6420,,(760) 634-6424,,"Distributor, Shipper, Produce,","Broccoli, Brussels Sprouts, Celery, Celery, Cherry Tomatoes, Cucumbers, Eggplant, Fruits, Green Beans, Green Onions, Green Peas, Mangoes, Melons, Peppers, Roma, Squash, Strawberries, Sweet Corn, Tangelos, Tomatoes, Vegetables,",Jacobs Malcolm & Burtt (Inc),,PO BOX 885464,SAN FRANCISCO,CA,94188-5464,USA,(415) 285-0400,jmbproduce@hotmail.com,(415) 285-2056,,"Commission Merchant, Exporter, Importer, Jobber, Shipper, Produce,","Apples, Asparagus, Avocados, Berries, Cantaloupes, Citrus Fruits, Deciduous, Lettuce, Melons, Onions, Potatoes, Radishes, Tomatoes, Tropical Fruits, Tropical Vegetables,",Jacobs Malcolm & Burtt (Inc),,645 N STOCKTON ST,LODI,CA,95240-0632,USA,(209) 367-0990,,(209) 367-4116,,"Shipper, Produce,","Asparagus, Fruits, Vegetables,",Jasmine Vineyards Inc,,11239 FAMOSO PORT HWY,DELANO,CA,93215-9460,USA,(661) 792-2141,jvine@jasminevineyards.com,(661) 792-6365,,"Grower, Shipper, Produce,","Grapes, PMA Member,",Http://www.jasminevineyards.comJensen Farms Inc,,920 LANE ST,FORT MORGAN,CO,80701-2808,USA,(970) 542-9773,jensfarms@aol.com,(970) 542-0158,,"Grower, Packer, Shipper, Produce,","Onions,",Johnson Farms,,PO BOX 114,WALHALLA,ND,58282-0114,USA,(701) 549-2456,,(701) 549-3431,,"Grower, Shipper, Produce,","Potatoes, Seed Potatoes,",Jones Produce Inc,,PO BOX 487,QUINCY,WA,98848-0487,USA,(509) 787-3537,,(509) 787-1895,,"Grower, Packer, Processor, Shipper, Produce,","Potatoes,","Jones Produce LLC, Dewey",,PO BOX 767,CROSSVILLE,TN,38557-0767,USA,(931) 484-3443,,,,"Broker, Grower, Packer, Shipper, Produce,","Green Beans,","Jorde Co, Jim",,PO BOX 777,CANDO,ND,58324-0777,USA,(701) 968-3357,,,,"Grower, Produce,","Seed Potatoes,",Jumbo Distributing Inc,,30273 Corte Coelho Rd,TEMECULA,CA,92591-1691,USA,(951) 699-0162,,(951) 699-8573,,"Buying Broker, Distributor, Shipper, Produce,","Broccoli, Cauliflower, Citrus Fruits, Fruits, Grapes, Melons, Sweet Corn, Vegetables,",K B & R Trading Corp,,"33 Newman Springs Rd, Ste B",TINTON FALLS,NJ,07724-2644,USA,(732) 842-0746,,(732) 224-9290,,"Buying Broker, Broker, Distributor, Shipper, Produce,","Citrus Fruits, Fruits, Onions, Potatoes, Tomatoes, Tropical Fruits, Tropical Vegetables, Vegetables, Watermelons,","Karam & Son Inc, Fred",,889 N SOUTH RD,SCRANTON,PA,18504-1409,USA,(570) 342-7795,,,,"Food Service, Jobber, Packer, Repacker, Produce,","Tomatoes,","Katz Produce Inc, Sy",,PO BOX 552,BOONE,NC,28607-0552,USA,(828) 297-7121,southernstar@usa.net,(828) 297-5884,,"Buying Broker, Importer, Sales Agency, Shipper, Produce,","Cantaloupes, Cucumbers, Eggplant, Fruits, Green Beans, Honeydew Melons, Mixed Vegetables, Peppers, PMA Member, Squash, Tomatoes,","Katz Produce Inc, Sy",,PO BOX 552,BOONE,NC,28607-0552,USA,(828) 297-7121,,(269) 297-5884,,"Buying Broker, Shipper, Produce,","Apples, Blueberries, Cabbage, Cantaloupes, Carrots, Celery, Cherry Tomatoes, Chili, Cucumbers, Eggplant, Escarole, Fruits, Green Beans, Lettuce, Peaches, Pears, Peppers, Plums, Pumpkins, Radishes, Romaine, Spinach, Squash, Strawberries, Tomatoes, Vegetables,","Katz Produce Inc, Sy",,PO Box 552,BOONE,NC,28607,USA,(954) 946-3630,,(954) 946-3648,,"Buying Broker, Importer, Sales Agency, Shipper, Produce,","Cantaloupes, Cucumbers, Eggplant, Fruits, Green Beans, Honeydew Melons, Mixed Vegetables, Peppers, Tomatoes,","Katz Produce Inc, Sy",,PO Box 552,BOONE,NC,28607-0552,USA,(229) 559-1705,,(229) 559-1867,,"Buying Broker, Sales Agency, Shipper, Produce,","Cucumbers, Eggplant, Fruits, Mixed Vegetables, Peppers,","Katz Produce Inc, Sy",,PO Box 552,BOONE,NC,28607-0552,USA,(910) 533-2966,southernstar@usa.net,(910) 533-2965,,"Broker, Packer, Sales Agency, Shipper, Produce,","Cabbage, Chili, Cucumbers, Eggplant, Green Beans, Peppers, Squash, Tomatoes, Vegetables,",Katz Produce Sales LLC,,PO BOX 609,PLOVER,WI,54467-0609,USA,(715) 344-7659,katzsales@charter.net,(715) 344-4788,,"Sales Agency, Shipper, Produce,","Onions, Potatoes,",Kern River Produce Inc,,1701 WESTWIND DR STE 117,BAKERSFIELD,CA,933013048,USA,(661) 633-2400,sales@kernriverproduce.com,(661) 633-2433,,"Distributor, Sales Agency, Shipper, Produce,","Carrots, Onions, Potatoes, Yam,",King Fresh Produce LLC,,8140 W MINERAL KING AVE,VISALIA,CA,93291-9658,USA,(559) 651-8070,,(559) 651-8060,,"Buying Broker, Broker, Exporter, Grower, Importer, Shipper, Produce,","Apples, Apricots, Asparagus, Berries, Broccoli, Cantaloupes, Carrots, Cauliflower, Celery, Citrus Fruits, Fresh Cut, Lemons, Lettuce, Nectarines, Oranges, Peaches, Pears, Plums, PMA Member, Pomegranates, Strawberries, Tangerines, Watermelons,",Http://www.kingfresh.comKing-Pak Potato Co,,PO BOX 22A,EDISON,CA,93220-0020,USA,(661) 366-3267,,(661) 366-0471,,"Grower, Shipper, Produce,","Potatoes,","Kovacevich International Inc, T M",,3301 S GALLOWAY ST STE 236,PHILADELPHIA,PA,19148-5406,USA,(215) 334-1676,,(215) 336-2866,,"Broker, Importer, Shipper, Produce,","Cantaloupes, Honeydew Melons, Squash,",Krichmar Produce,,"1370 S Main Rd, PMB 135",VINELAND,NJ,08360-6501,USA,(856) 563-0040,krichmars@aol.com,(856) 563-0044,,"Buying Broker, Shipper, Produce,","Fruits, Vegetables,",LA Consolidation,,PO Box 277,CHINO,CA,91708-0277,USA,(213) 746-1940,,(213) 746-2921,,"Consolidation, Shipper, Produce, Transportation,","Fruits, Vegetables,",LA Nut,,"1601 E Olympic Blvd, Ste 222",LOS ANGELES,CA,90021-1941,USA,(213) 452-0045,,(213) 438-0825,,"Distributor, Exporter, Packer, Shipper, Produce,","Almonds, Nuts, Peanuts, Pecans,",Lange Trading Company Inc,,PO BOX 19261,SPRINGFIELD,IL,62794-9261,USA,(217) 786-3300,,(217) 786-2570,,"Distributor, Packer, Shipper, Produce,","Fruits, Vegetables,",Langlade Potato Distributing Inc,,PO BOX 578,ANTIGO,WI,54409-0578,USA,(715) 627-4873,langlade@newnorth.net,(715) 627-4891,,"Buying Broker, Shipper, Produce,","Onions, Potatoes,",Langlade Potato Distributing Inc,,PO BOX 578,ANTIGO,WI,54409-0578,USA,(715) 325-7783,,(715) 325-7707,,"Buying Broker, Shipper, Produce,","Onions, Potatoes,",Lauritzen Inc,,W5539 COUNTY K,WILD ROSE,WI,54984,USA,(715) 258-5985,,(715) 258-5930,,"Grower, Packer, Shipper, Produce,","Cucumbers, Fruits, Potatoes, Vegetables,","Lawrence Sales Inc, Manny",,PO Box 99,SANTA YNEZ,CA,93460,USA,(805) 693-1300,,(805) 686-4773,,"Broker, Food Service, Shipper, Produce,","Apples, Apricots, Asparagus, Blackberries, Blueberries, Broccoli, Brussels Sprouts, Cabbage, Cantaloupes, Carrots, Cauliflower, Celery, Cherries, Fruits, Grapes, Kiwi, Lettuce, Mixed Vegetables, Nectarines, Peaches, Peppers, Plums, Sweet Corn, Vegetables,",Leger & Son Inc,,PO BOX 686,CORDELE,GA,31010-0686,USA,(229) 273-4548,legerandson@bellsouth.net,(229) 273-4998,,"Grower, Shipper, Produce,","PMA Member, Watermelons,",Http://www.legerandson.com"Leone Produce Inc, Alfred S",,PO Box 558,MINOTOLA,NJ,08341-0558,USA,(856) 794-2794,aleone2630@aol.com,(856) 794-9397,,"Buying Broker, Broker, Cold Storage, Distributor, Importer, Repacker, Shipper, Produce,","Apples, Basil, Chilean Fruit, Chives, Eggplant, Endive, Escarole, Fruits, Green Onions, Greens, Herbs, Lettuce, Mint, Onions, Parsnips, Peaches, Peppers, Pumpkins, Sage, Shallots, Spices, Squash, Sweet Potatoes, Thyme, Tomatoes, Turnips, Vegetables,",Lewis Taylor Farms Inc,,195 TyTy Omega Rd,TIFTON,GA,31793,USA,(229) 382-4454,brim2@planttel.net,(229) 382-8930,,"Grower, Packer, Shipper, Produce,","Cabbage, Cantaloupes, Collards, Cucumbers, Eggplant, Peppers, Squash, Tomatoes,",Lone Wolf Farms,,PO Box 317,MINTO,ND,58261-0317,USA,(701) 248-3482,,(701) 248-3508,,"Broker, Grower, Packer, Shipper, Produce,","Potatoes,",Http://www.lonewolffarms.com"Macias Co Inc, Mario",,PO Box 81746,BAKERSFIELD,CA,93380-1746,USA,(661) 391-0668,mario@buygrapes.com,(661) 391-8336,,"Buying Broker, Broker, Sales Agency, Shipper, Produce,","Apples, Fruits, Grapes, Kiwi, Nectarines, Peaches, Plums, Vegetables,","Macias Co Inc, Mario",,,BAKERSFIELD,CA,.....,USA,(661) 391-0668,,(661) 391-8336,,"Buying Broker, Broker, Sales Agency, Shipper, Produce,","Apples, Fruits, Grapes, Kiwi, Nectarines, Peaches, Plums, Vegetables,","Macrie Inc, Paul J",,PO BOX 149,HAMMONTON,NJ,08037-0149,USA,(609) 561-2460,pmacrie1228@msn.com,(609) 561-0034,,"Buying Broker, Distributor, Shipper, Produce,","Asparagus, Blueberries, Cabbage, Collards, Cucumbers, Eggplant, Endive, Escarole, Fruits, Green Beans, Greens, Lettuce, Mustard Greens, Onions, Peaches, Peppers, Romaine, Spinach, Squash, Strawberries, Sweet Corn, Sweet Potatoes, Tomatoes, Turnips, Vegetables,","Macrie Inc, Paul J",,PO BOX 149,HAMMONTON,NJ,08037-0149,USA,(800) 229-2460,,,,"Buying Broker, Shipper, Produce,","PMA Member, Sweet Potatoes, Vegetables,","Macrie Inc, Paul J",,PO BOX 149,HAMMONTON,NJ,08037-0149,USA,(800) 229-2460,,(609) 561-2966,,"Buying Broker, Shipper, Produce,","Asparagus, Cabbage, Cantaloupes, Cauliflower, Cherry Tomatoes, Chili, Cucumbers, Eggplant, Green Beans, Green Onions, Green Peas, Greens, Herbs, Honeydew Melons, Leeks, Lettuce, Melons, Mixed Vegetables, Peppers, Pickle Cucumbers, Potatoes, Pumpkins, Squash, Strawberries, Sweet Corn, Tomatoes, Watermelons,","Macrie Inc, Paul J",,,VINELAND,NJ,8360,USA,(800) 229-2460,,,,"Buying Broker, Distributor, Shipper, Produce,","Fruits, Vegetables,","Macrie Inc, Paul J",,PO BOX 149,HAMMONTON,NJ,08037-0149,USA,(800) 229-9533,,(609) 561-2966,,"Buying Broker, Distributor, Shipper, Produce,","Fruits, Onions, Vegetables, Watermelons,","Macrie Inc, Paul J",,PO BOX 149,HAMMONTON,NJ,08037-0149,USA,(800) 229-9533,,,,"Buying Broker, Distributor, Shipper, Produce,","Cucumbers, Fruits, Green Beans, Onions, Squash, Vegetables, Watermelons,",